{
  "schema": "hero-model-b-robustness-input/v1",
  "source_kind": "SYNTHETIC_ROBUSTNESS_SHAPED",
  "provenance": {
    "synthetic_fixture": true,
    "real_issue_367_consumed": false,
    "validation_consumed": false,
    "test_consumed": false
  },
  "information_boundary": {
    "hero_ev_consumed": false,
    "model_a_consumed": false,
    "recommendation_consumed": false,
    "future_cards_consumed": false,
    "opponent_hole_cards_consumed": false,
    "route_as_predictive_target": false
  },
  "hero_entry": {
    "decision_id": "synthetic-ood-unsupported-001",
    "context_id": "synthetic-ood-unsupported-context-001",
    "hero_position": "SB",
    "action": "ISO",
    "sizing": 6.0,
    "ev": 0.95,
    "uncertainty": {
      "ci95": [0.85, 1.05],
      "width_bb": 0.2,
      "source": "synthetic_ood_paired_ci95_v1"
    },
    "paired_delta": 0.35,
    "route_source": "synthetic_robustness_route_iso_6_ood",
    "support": {
      "status": "OOD_UNTESTABLE",
      "tier": "UNKNOWN",
      "ood": true
    },
    "posterior_refs": null,
    "alternatives": [
      {
        "alternative_id": "ISO@5",
        "action": "ISO",
        "sizing": 5.0,
        "ev": 0.6,
        "uncertainty": {
          "ci95": [0.5, 0.7],
          "width_bb": 0.2,
          "source": "synthetic_ood_paired_ci95_v1"
        },
        "paired_delta": 0.0,
        "route_source": "synthetic_robustness_route_iso_5_ood",
        "support": {
          "status": "OOD_UNTESTABLE",
          "tier": "UNKNOWN",
          "ood": true
        },
        "posterior_refs": null
      },
      {
        "alternative_id": "OVERLIMP@1",
        "action": "OVERLIMP",
        "sizing": 1.0,
        "ev": 0.25,
        "uncertainty": {
          "ci95": [0.15, 0.35],
          "width_bb": 0.2,
          "source": "synthetic_ood_paired_ci95_v1"
        },
        "paired_delta": -0.35,
        "route_source": "synthetic_robustness_route_overlimp_1_ood",
        "support": {
          "status": "OOD_UNTESTABLE",
          "tier": "UNKNOWN",
          "ood": true
        },
        "posterior_refs": null
      }
    ]
  }
}
