{
  "schema": "hero-model-b-robustness-input/v1",
  "source_kind": "SYNTHETIC_ROBUSTNESS_SHAPED",
  "provenance": {
    "synthetic_fixture": true,
    "real_issue_367_consumed": false,
    "validation_consumed": false,
    "test_consumed": false
  },
  "information_boundary": {
    "hero_ev_consumed": false,
    "model_a_consumed": false,
    "recommendation_consumed": false,
    "future_cards_consumed": false,
    "opponent_hole_cards_consumed": false,
    "route_as_predictive_target": false
  },
  "hero_entry": {
    "decision_id": "synthetic-robust-consistent-001",
    "context_id": "synthetic-robust-consistent-context-001",
    "hero_position": "SB",
    "action": "ISO",
    "sizing": 5.0,
    "ev": 1.42,
    "uncertainty": {
      "ci95": [1.39, 1.45],
      "width_bb": 0.06,
      "source": "synthetic_paired_ci95_v1"
    },
    "paired_delta": 0.35,
    "route_source": "synthetic_robustness_route_iso_5",
    "support": {
      "status": "CONSISTENT",
      "tier": "HIGH",
      "ood": false
    },
    "posterior_refs": [
      "synthetic-posterior-robust-consistent-iso-5-01",
      "synthetic-posterior-robust-consistent-iso-5-02"
    ],
    "alternatives": [
      {
        "alternative_id": "ISO@4",
        "action": "ISO",
        "sizing": 4.0,
        "ev": 1.07,
        "uncertainty": {
          "ci95": [1.04, 1.1],
          "width_bb": 0.06,
          "source": "synthetic_paired_ci95_v1"
        },
        "paired_delta": 0.0,
        "route_source": "synthetic_robustness_route_iso_4",
        "support": {
          "status": "CONSISTENT",
          "tier": "HIGH",
          "ood": false
        },
        "posterior_refs": [
          "synthetic-posterior-robust-consistent-iso-4-01"
        ]
      },
      {
        "alternative_id": "ISO@6",
        "action": "ISO",
        "sizing": 6.0,
        "ev": 0.72,
        "uncertainty": {
          "ci95": [0.69, 0.75],
          "width_bb": 0.06,
          "source": "synthetic_paired_ci95_v1"
        },
        "paired_delta": -0.35,
        "route_source": "synthetic_robustness_route_iso_6",
        "support": {
          "status": "CONSISTENT",
          "tier": "HIGH",
          "ood": false
        },
        "posterior_refs": [
          "synthetic-posterior-robust-consistent-iso-6-01"
        ]
      }
    ]
  }
}
